{
  "$schema": "../../configs/train.schema.json",
  "data": {
    "path": "./pretrain-data.txt",
    "seq_len": 512,
    "batch_size": 16,
    "gradient_accumulation_steps": 1,
    "shard_size": 10000
  },
  "optimizer": {
    "weight_decay": 0.1,
    "b1": 0.9,
    "b2": 0.95,
    "max_grad_norm": 1.0,
    "schedule": {
      "peak_lr": 6e-4,
      "end_lr": 6e-5,
      "warmup_steps": 2000
    }
  },
  "epochs": 1,
  "seed": 42,
  "checkpoint": "./checkpoints/pretrain.safetensors"
}
